page no.,title,url,details,post date
7,外傭幣ICO (高天佑),http://startupbeat.hkej.com/?p=55780,外傭短缺加上香港寸金尺土，一間「工人房」隨時價值幾百萬元，很多小家庭其實不需要及容不下外傭24小時長駐，故此讓外傭blockchain化，並引進Uber式配對系統，甚或發行「外傭幣」ICO，應該是一條出路。,"Posted February 15, 2018"
7,趙長鵬發達之謎 (高天佑),http://startupbeat.hkej.com/?p=55709,趙長鵬在去年7月才創辦的「幣安網」（Binance），一來已算起步得很遲，二來資金並不雄厚（主要靠趙長鵬變賣上海物業及Bitcoin作創業資金），為何偏偏能夠跑出，一躍成為中國最大、全球第三大玩家？,"Posted February 14, 2018"
7,WeChat Pay HK派888萬利是搶新客,http://startupbeat.hkej.com/?p=55674,內地於農曆新年派電子利是的熱潮蔓延本港，騰訊（00700）旗下流動支付平台WeChat Pay HK由昨天（2月12日）至3月2日派發WeChat利是，該公司估計，今次派出的利是總值超過888萬元。,"Posted February 13, 2018"
8,港人應用金融科技最憂保安,http://startupbeat.hkej.com/?p=55663,渣打香港調查顯示，港人願意利用更多金融科技來管理財富，而使用金融科技時，最大憂慮是保安問題。至於早前金管局推出關於虛擬銀行的諮詢，渣打香港資訊科技總監洪滿霜表示，該行正研究及消化有關資料，暫未有結論。,"Posted February 13, 2018"
8,中國虛擬貨幣首富 (高天佑),http://startupbeat.hkej.com/?p=55657,收到《福布斯》（Forbes）寄來最新一期雜誌，封面人物是一名41歲中國人趙長鵬（網名CZ）。他除了是全球第三大虛幣交易平台老闆，也是其中一款主要虛幣的發行者兼莊家，相當於又開賭場、又印銀紙，想不發達都難。,"Posted February 13, 2018"
8,銀行金融科技指引更新與時並進 (方保僑),http://startupbeat.hkej.com/?p=55653,金管局在2000年首次發出《虛擬銀行的認可》指引，至今已過了十多年。早前金管局再次檢視該指引，進一步考慮到金融科技的發展，以及銀行體系的穩定和存戶利益的保障，上星期金管局發布了《虛擬銀行的認可》指引修訂本並諮詢公眾。,"Posted February 13, 2018"
8,JETCO Pay夥8銀行購物繳費,http://startupbeat.hkej.com/?p=55571,銀通聯同8家本地銀行，推出香港首個連接銀行戶口的流動支付服務JETCO Pay，目前領展（00823）旗下的樂富及黃大仙停車場已接受JETCO Pay支付，未來冀逐步擴展至領展旗下商戶及街市。,"Posted February 9, 2018"
8,八達通推電子利是 冀新春搶客 支付戰升級 WeChat Pay消費送紅包,http://startupbeat.hkej.com/?p=55564,八達通App推出「e利市」功能，用家可以透過二維碼「派利是」及「逗利是」，輸入利是金額後就會自動生成QR Code，親友以八達通App掃描後，即時獲得利是錢，亦設有「搶紅包」鬥快搶利是。,"Posted February 9, 2018"
8,虛擬銀行不限最低戶口結餘 金管局展開諮詢 資本3億起跳,http://startupbeat.hkej.com/?p=55472,於2000年制定的《虛擬銀行的認可》指引的基本原則仍然適用，包括最低資本3億元，申請人必須提出具體可信的業務計劃，但不能採取掠奪性（predatory）定價、妥善管理風險、及與銀行一樣遵守其他監管措施，例如充足資本比率要求等。,"Posted February 7, 2018"
8,第一場AI股災 (高天佑),http://startupbeat.hkej.com/?p=55465,「止蝕不止賺」不但是本報已故曹Sir的金石良言，也是環球很多投資門派的圭臬，AI受到「耳濡目染」難免亦奉行此原則。於是當某些沽貨時機被觸發，AI集體沽貨之後，一併帶動更多止蝕盤湧現，愈跌愈沽，愈沽愈跌，釀成短時間內人踩人大崩盤。,"Posted February 7, 2018"
8,萊茨狗大戰加密貓,http://startupbeat.hkej.com/?p=55457,百度在剛過去的周日（4日）推出「萊茨狗」遊戲，測試區塊鏈技術。用戶只要登入百度賬號，就可領養首隻虛擬寵物狗，同時獲得1000微積分；若領養第二隻，則須先行下載百度錢包儲存微積分，並連接其他百度服務。,"Posted February 7, 2018"
8,淘寶騰訊紅包戰豪派12億  螞蟻金服傳申消費金融牌,http://startupbeat.hkej.com/?p=55433,央視《春節聯歡晚會》一向是商家必爭之地，淘寶宣布與2018年央視春晚達成獨家合作，承包今年春晚上的所有紅包。此次活動共分為5天，紅包金額達10億元，在2月11至15日，每日發放總值1億元的現金紅包，年三十當晚發放6億元。,"Posted February 6, 2018"
8,內地擬禁買賣境外虛擬幣,http://startupbeat.hkej.com/?p=55393,人民銀行主管的《金融時報》報道，針對境內外首次代幣發行（ICO）和虛擬貨幣交易，中國將採取一系列監管措施，包括取締相關商業存在，取締、處置境內外虛擬貨幣交易平台網站等。,"Posted February 5, 2018"
9,CryptoKitties強攻星港台 以太幣「買貓」 交易額逾3億,http://startupbeat.hkej.com/?p=55375,自去年11月底推出的以太坊虛擬育貓遊戲CryptoKitties成為熱話。遊戲開發團隊AxiomZen成員江家俊日前接受本報專訪，透露將於App Store推出遊戲流動程式版本，主攻香港、台灣及新加坡市場。,"Posted February 5, 2018"
9,比特幣V彈波幅逾千美元,http://startupbeat.hkej.com/?p=55365,虛擬貨幣持續有恐慌性拋售，比特幣（Bitcoin）於香港時間周五早上跌穿9000美元，傍晚再失守8000美元大關，低見7695.1美元，其後跌幅收窄，並一舉收復9000美元，單日波幅超過1000美元。,"Posted February 3, 2018"
9,劏房幣救廢青 (高天佑),http://startupbeat.hkej.com/?p=55313,不少人憧憬《財政預算案》會否繼2011年後再次「派錢」。但其實，與其派銀紙一萬幾千元，例不如由港府推出「劏房幣」（Mini-Flats Coin），幣值跟劏房呎價掛鈎，讓「廢青」們可以逐少收集，令上車夢成功率增添幾個巴仙。,"Posted February 2, 2018"
9,阿里購螞蟻金服33%謀IPO  去季收入增56% 股價跌穿200美元,http://startupbeat.hkej.com/?p=55302,昨晚阿里公布財政年度第三季業績時，亦一併宣布將會入股螞蟻金服，並會得到33%股權。阿里執行副主席蔡崇信在電話會議內稱，螞蟻金服三項核心業務「很賺錢」，是次交易有利雙方加強戰略合作。,"Posted February 2, 2018"
9,電子支付鬥搶數據 (香港智慧城市聯盟陳家豪),http://startupbeat.hkej.com/?p=55289,本港「手機錢包」電子支付服務愈來愈盛行，為了解用戶消費習慣，企業收集大量交易數據，當中或存在侵犯私隱的問題。《信報》StartupBeat請來香港智慧城市聯盟金融科技委員會主席陳家豪，探討港企應如何升級轉型，以把握電子支付的機遇。,"Posted February 2, 2018"
9,虛擬銀行冀今年開始營運,http://startupbeat.hkej.com/?p=55249,金管局助理總裁（金融基建）李樹培透露，該局短期內會就虛擬銀行的營運指引進行諮詢。他並表示，已有逾10家有興趣的機構與金管局進行探討，冀今年會有虛擬銀行營運。虛擬銀行成功與否視乎市場情況，該局主要是提供良好的營運環境。,"Posted February 1, 2018"
9,微信湧現網貸 官媒促嚴管,http://startupbeat.hkej.com/?p=55245,騰訊（00700）微信內的小程序被市場視為另一殺着，勢改變目前手機應用程式的生態。不過，新華社旗下「新華視點」昨天發文，直指小程序平台需要加強監管，因為有不少貸款公司利用小程序在網上經營非法現金貸款。,"Posted February 1, 2018"
9,fb封殺虛擬幣廣告,http://startupbeat.hkej.com/?p=55236,除了監管機構緊盯外，Facebook（fb）最近「落井下石」，決定全面禁止虛擬貨幣、首次代幣發行（ICO）和二元期權（Binary options）在旗下社交平台上賣廣告，Instagram也不例外。,"Posted February 1, 2018"
9,App內買賣兼營借貸 LINE招兵進軍加密幣,http://startupbeat.hkej.com/?p=55230,日本即時通訊程式LINE昨天宣布，新設一間處理加密貨幣交易的金融子公司LINE Financial，除了推出自家加密貨幣，並通過LINE應用程式進行買賣，同時提供借貸、保險等其他服務，現正等待監管部門開綠燈。,"Posted February 1, 2018"
9,日查虛擬幣失竊 Bitcoin下滑3%,http://startupbeat.hkej.com/?p=55212,虛擬貨幣交易所Coincheck遭黑客入侵以致損失約580億日圓（約42億港元），日本金融廳昨天正式啟動對所有同類交易所的調查，就顧客資產與系統管理體系進行詢問，一旦發現問題就實施入內調查。,"Posted January 31, 2018"
